{
  "id": "pr-review-validation-commands",
  "description": "Explicit validation_commands should make reviewer-tester-loop eligible without duplicating evidence in available_evidence.",
  "input": {
    "task": "Review a code diff that changes cache invalidation behavior.",
    "task_type": "pr_review",
    "complexity": 3,
    "risk": 3,
    "requires_code_changes": false,
    "validation_commands": ["npm test -- cache.test.js"]
  },
  "expected": {
    "selected_strategy": "reviewer-tester-loop",
    "eligible": true,
    "agents": ["tester", "reviewer"],
    "safety_gate": {
      "requires_human_approval": false
    }
  }
}
