{
  "id": "pr-review-reviewer-tester",
  "description": "A risky PR review with test evidence should choose reviewer and tester specialists.",
  "input": {
    "task": "Review a code diff that changes auth middleware and cache invalidation.",
    "task_type": "pr_review",
    "complexity": 4,
    "risk": 4,
    "requires_code_changes": false,
    "requires_tests": true,
    "available_evidence": ["diff", "test_commands"]
  },
  "expected": {
    "selected_strategy": "reviewer-tester-loop",
    "eligible": true,
    "agents": ["tester", "reviewer"],
    "safety_gate": {
      "requires_human_approval": false
    }
  }
}
