{
  "id": "architecture-debate",
  "description": "A durable architecture decision with competing options should activate a bounded debate panel.",
  "input": {
    "task": "Choose between plugin-based architecture and hardcoded workflow architecture.",
    "task_type": "architecture_decision",
    "complexity": 4,
    "risk": 3,
    "parallelizable": true,
    "has_competing_options": true,
    "has_decision_criteria": true,
    "user_requested_debate": true
  },
  "expected": {
    "selected_strategy": "debate-critic-panel",
    "eligible": true,
    "agents": ["architect", "critic", "reviewer"],
    "expected_outputs": [
      "accepted_findings",
      "rejected_findings",
      "unresolved_risks",
      "validation_plan"
    ]
  }
}
